{
  "schema_version": "keddeh.worker-template.v1",
  "worker_template_id": "keddeh.worker.administration.v1",
  "version": 1,
  "role": "administration",
  "permissions": [
    "inspect"
  ],
  "adapter": "local.inspector.v1",
  "expertise": {
    "declared": "administration",
    "measured": "local artifact canary only",
    "model_binding": null
  },
  "limits": {
    "max_artifact_bytes": 65536,
    "max_attempts": 3
  }
}
